#CODE;ENGLISH;FRENCH;GERMAN;;SPANISH;;;;;;;;;x,,
EVTDESC_divinemarriage2;Inbreeding protection should be given to children of what faithful, close-kin Invictus unions?;La protection de la consanguinité devrait être accordée aux enfants de quelles unions fidèles et proches?;Inzuchtschutz sollte Kindern von welchen treuen, nahen Verwandten gewährt werden?;;La protección de la endogamia debería otorgarse a los hijos de las uniones fieles y cercanas?;;;;;;;;;x
divinemarriage_only_married;Only divine marriages.;Seuls les mariages divins.;Nur göttliche Ehen.;;Sólo los matrimonios divinos.;;;;;;;;;x,,
divinemarriage_also_concubines;Also holy concubines and consorts.;Aussi concubines et consorts sacrés;Auch heilige Konkubinen und Konsorten;;También santos concubines y consortes.;;;;;;;;;x,,
divinemarriage_also_bastards;Even bastards can be sacred.;Même les bâtards peuvent être sacrés.;Sogar Bastarde können heilig sein.;;Incluso los bastardos pueden ser sagrados.;;;;;;;;;x,,
divine_marriage_options;Set Divine Marriage Options;Définir les options de mariage divin;Stellen Sie göttliche Heiratsoptionen ein;;Establecer opciones de matrimonio divino;;;;;;;;;x,,
divine_marriage_options_desc;Set Divine Marriage Options;Définir les options de mariage divin;Stellen Sie göttliche Heiratsoptionen ein;;Establecer opciones de matrimonio divino;;;;;;;;;x,,
